{
  "$schema": "http://json-schema.org/draft-07/schema#",
  "$id": "https://github.com/aztechead/loop-spec/graph/schema.json",
  "title": "loop-spec workflow graph",
  "type": "object",
  "required": ["nodes", "edges"],
  "additionalProperties": false,
  "properties": {
    "id": { "type": "string" },
    "entry": {
      "oneOf": [
        { "type": "string" },
        { "type": "array", "items": { "type": "string" }, "minItems": 1 }
      ]
    },
    "nodes": {
      "type": "array",
      "minItems": 1,
      "items": { "$ref": "#/definitions/node" }
    },
    "edges": {
      "type": "array",
      "items": { "$ref": "#/definitions/edge" }
    }
  },
  "definitions": {
    "stateKey": {
      "type": "string",
      "enum": [
        "schemaVersion",
        "slug",
        "feature_title",
        "createdAt",
        "updatedAt",
        "execStyle",
        "executionProfile",
        "currentPhase",
        "completedPhases",
        "branch",
        "worktreePath",
        "executionRootMode",
        "baseSha",
        "baseBranch",
        "models",
        "phaseModels",
        "artifacts",
        "currentTeamName",
        "currentTeammates",
        "currentGate",
        "commands",
        "workspace",
        "stalenessHours",
        "prUrl",
        "checkpointPrUrl",
        "delivery",
        "verificationBaseline",
        "verificationBaselineAttempted",
        "verificationBaselineOptIn",
        "warnings",
        "mergeQueue",
        "pendingRemediationTasks",
        "activeWorkflow",
        "harnessTaskMetadataMode",
        "harnessStatusMode",
        "fileConflictExcludeGlobs",
        "gateHistory",
        "autonomousClassification",
        "gatePlan",
        "currentPhaseStartedAt",
        "iterate",
        "greenfield",
        "protected",
        "autonomous",
        "backlogEntry",
        "backlogEntryId",
        "driverNext",
        "driverRedo",
        "handoffSession",
        "artifactSink",
        "specApproval",
        "specIntentSeen",
        "specApprovalHistory",
        "instructionSnapshots",
        "reviewRouting",
        "routeJudgment"
      ]
    },
    "effort": {
      "type": "string",
      "enum": ["system1", "system2"]
    },
    "routeCondition": {
      "type": "object",
      "required": ["probe", "args", "expects"],
      "additionalProperties": false,
      "properties": {
        "probe": {
          "type": "string",
          "minLength": 1,
          "description": "Repo-relative path to an executable probe script"
        },
        "args": {
          "type": "array",
          "items": { "type": "string" },
          "description": "Probe argument vector. {featureDir}, {repoRoot}, {featureRepoRoot}, {slug}, {node}, {baseSha} are engine-substituted placeholders; no other placeholder is legal. May be empty."
        },
        "expects": {
          "type": "string",
          "pattern": "^[^|]+$",
          "description": "Exact expected probe answer token. No '|' alternation -- declare separate edges instead."
        }
      }
    },
    "phasePath": {
      "type": "string",
      "minLength": 1,
      "description": "A path or argument phase-entry.sh / phase-exit.sh resolves at call time. Placeholders: {docs} (the feature's docs directory, docs/loop-spec/features/<slug>), {featureDir}, {root} (the repository root, or the workspace root in workspace mode), {slug}, {spec} (artifacts.spec or {docs}/SPEC.md), {tasks} (the owning feature's {featureDir}/tasks.json; saved artifact locators never select another checkout), {f:<dotted.key>} (that feature.json value). No other placeholder is legal."
    },
    "phaseIngress": {
      "type": "object",
      "required": ["fields"],
      "additionalProperties": false,
      "description": "What lib/phase-entry.sh lists when the phase opens: the feature.json keys its packet carries and the files it reads. Only a phase agent node (body skills/<id>/SKILL.md) may declare it.",
      "properties": {
        "fields": {
          "type": "array",
          "items": { "type": "string", "minLength": 1 },
          "description": "feature.json keys (dotted paths allowed) the packet carries; absent ones read null"
        },
        "required": {
          "type": "array",
          "items": {
            "type": "object",
            "required": ["writer", "path"],
            "additionalProperties": false,
            "properties": {
              "writer": { "type": "string", "minLength": 1, "description": "The phase that should have written the file, named in the FLAG when it is absent" },
              "path": { "$ref": "#/definitions/phasePath" }
            }
          }
        },
        "optional": {
          "type": "array",
          "items": { "$ref": "#/definitions/phasePath" },
          "description": "Files listed only when present"
        },
        "skeletons": {
          "type": "array",
          "items": {
            "type": "object",
            "required": ["path", "template"],
            "additionalProperties": false,
            "properties": {
              "path": { "$ref": "#/definitions/phasePath" },
              "template": { "type": "string", "minLength": 1, "description": "A file under skills/shared/artifact-templates/; the driver's phase-begin writes it to path when path is absent, with the facts it holds filled" }
            }
          },
          "description": "Artifacts the driver writes in the shape the exit gates accept before the phase opens (lib/graph/driver.py phase-begin)"
        }
      }
    },
    "phaseGate": {
      "type": "object",
      "required": ["label", "body"],
      "additionalProperties": false,
      "properties": {
        "label": { "type": "string", "minLength": 1, "description": "The [label] every relayed finding carries" },
        "body": { "type": "string", "minLength": 1, "description": "Repo-relative .sh script, the same shape as a gate node body" },
        "args": {
          "type": "array",
          "items": { "$ref": "#/definitions/phasePath" }
        },
        "when": {
          "type": "object",
          "required": ["field", "equals"],
          "additionalProperties": false,
          "description": "Run only when this feature.json key (dotted path) reads as this string; absent means always",
          "properties": {
            "field": { "type": "string", "minLength": 1 },
            "equals": { "type": "string" }
          }
        }
      }
    },
    "phaseEgress": {
      "type": "object",
      "required": ["writes"],
      "additionalProperties": false,
      "description": "What lib/phase-exit.sh checks and records when the phase closes, in the order listed here. Only a phase agent node may declare it; a phase node without one has no exit gate (DELIVER: its terminal states are observation-only).",
      "properties": {
        "misplaced": {
          "type": "string",
          "minLength": 1,
          "description": "Artifact file name under {docs} to look for in the repository's other checkouts when it is absent here"
        },
        "required": {
          "type": "array",
          "items": {
            "type": "object",
            "required": ["label", "path"],
            "additionalProperties": false,
            "properties": {
              "label": { "type": "string", "minLength": 1 },
              "path": { "$ref": "#/definitions/phasePath" }
            }
          },
          "description": "Files whose absence is a FLAG [label] <path> missing"
        },
        "gates": {
          "type": "array",
          "items": { "$ref": "#/definitions/phaseGate" },
          "description": "Deterministic checks, run in order; a non-zero exit relays the body's findings as FLAG [label] lines"
        },
        "oracle": {
          "type": "boolean",
          "description": "When a supervisor is the run's oracle, the phase must have put a question to it"
        },
        "writes": {
          "type": "array",
          "items": { "type": "string", "minLength": 1 },
          "description": "feature.json paths (by prefix) the phase may change between entry and exit; the egress guard names any other"
        },
        "artifacts": {
          "type": "object",
          "additionalProperties": { "$ref": "#/definitions/phasePath" },
          "description": "artifacts.<key> pointers recorded on ok"
        },
        "artifactsIfPresent": {
          "type": "object",
          "additionalProperties": { "$ref": "#/definitions/phasePath" },
          "description": "artifacts.<key> pointers recorded on ok only when the file exists"
        },
        "artifactsDefault": {
          "type": "object",
          "additionalProperties": { "type": "string" },
          "description": "artifacts.<key> values recorded on ok only when the key is still null"
        },
        "onOk": {
          "type": "array",
          "items": { "$ref": "#/definitions/phaseGate" },
          "description": "Scripts run after every gate passed and before the commit (EXECUTE's at-end squash); a non-zero exit is a FLAG"
        },
        "commit": {
          "type": "object",
          "required": ["message", "paths"],
          "additionalProperties": false,
          "properties": {
            "message": { "$ref": "#/definitions/phasePath" },
            "paths": { "type": "array", "items": { "$ref": "#/definitions/phasePath" } }
          },
          "description": "Single-repo commit of the listed paths that exist; workspace mode keeps them local"
        },
        "checkpoint": {
          "type": "string",
          "minLength": 1,
          "description": "Checkpoint tag name recorded on ok (lib/checkpoint.sh tag)"
        },
        "set": {
          "type": "object",
          "description": "feature.json keys reset on ok, each to the JSON value given"
        },
        "close": {
          "type": "string",
          "enum": ["always", "terminal"],
          "description": "always: ok appends the phase to completedPhases and clears the team; terminal: only with --terminal (ITERATE's rewind pass leaves the phase open)"
        }
      }
    },
    "node": {
      "type": "object",
      "required": ["id", "kind", "reads", "writes", "effort"],
      "additionalProperties": false,
      "properties": {
        "id": { "type": "string", "minLength": 1 },
        "label": {
          "type": "string",
          "minLength": 1,
          "description": "Short human-facing name used in step descriptors and graph readers"
        },
        "kind": {
          "type": "string",
          "enum": ["agent", "function", "gate", "human", "subgraph"]
        },
        "reads": {
          "type": "array",
          "items": { "$ref": "#/definitions/stateKey" }
        },
        "writes": {
          "type": "array",
          "items": { "$ref": "#/definitions/stateKey" }
        },
        "optionalReads": {
          "type": "array",
          "items": { "$ref": "#/definitions/stateKey" },
          "description": "State keys the node consults but that are legitimately absent or null (an opt-out the schema documents, e.g. verificationBaseline without LOOP_SPEC_STARTUP_BASELINE=1). Entering the node never asserts them; the body owns the null case. A key may appear in reads or optionalReads, never both."
        },
        "effort": { "$ref": "#/definitions/effort" },
        "body": { "type": "string" },
        "skill": {
          "type": "string",
          "pattern": "^[a-z][a-z0-9-]*$",
          "description": "The skill the cycle invokes to run this agent node when it is not `loop-spec:<id>`: the driver prints `EXT skill=<name>` under NEXT and the cycle skill invokes `Skill(loop-spec:<name>)`. The spec node names the lite candidate skill so the short route never loads the full SPEC body (port audit 3, N4)."
        },
        "bodyArgs": {
          "type": "array",
          "items": { "type": "string" },
          "description": "Argument vector passed to a function/gate body. {featureDir}, {repoRoot}, {featureRepoRoot}, {slug}, {node}, {baseSha} are engine-substituted placeholders; no other placeholder is legal. Absent means the body is invoked with no arguments."
        },
        "graph": { "type": "string" },
        "authorizesDelivery": { "type": "boolean" },
        "admit": {
          "$ref": "#/definitions/routeCondition",
          "description": "Human-node pause gate (contract sec 4): admitted on entry writes a checkpoint and pauses; not admitted (including unresolved) skips the node. Only a human node may declare it."
        },
        "ingress": {
          "$ref": "#/definitions/phaseIngress",
          "description": "The phase's entry packet, read by lib/phase-entry.sh"
        },
        "egress": {
          "$ref": "#/definitions/phaseEgress",
          "description": "The phase's exit gate, run by lib/phase-exit.sh"
        },
        "routeDefault": {
          "type": "string",
          "minLength": 1,
          "description": "Node id to take when this node has route edges and none is satisfied. Absent means no-route is an abort, never a silent chain fallthrough (contract sec 3)."
        }
      }
    },
    "loopEdge": {
      "type": "object",
      "required": ["from", "to", "kind", "ceiling", "strategy"],
      "additionalProperties": false,
      "properties": {
        "from": { "type": "string" },
        "to": { "type": "string" },
        "kind": { "const": "loop" },
        "ceiling": { "type": "number", "exclusiveMinimum": 0 },
        "strategy": { "type": "string", "enum": ["unroll", "contain"] }
      }
    },
    "edge": {
      "type": "object",
      "required": ["from", "to", "kind"],
      "properties": {
        "from": { "type": "string", "minLength": 1 },
        "to": { "type": "string", "minLength": 1 },
        "kind": {
          "type": "string",
          "enum": ["chain", "route", "fanout", "fanin", "loop"]
        },
        "condition": { "$ref": "#/definitions/routeCondition" },
        "join": { "type": "string" },
        "ceiling": { "type": "number", "exclusiveMinimum": 0 },
        "strategy": { "type": "string", "enum": ["unroll", "contain"] },
        "sameSession": {
          "type": "boolean",
          "description": "true: the agent node this edge enters starts in the session that closed the previous phase (cycle-driver.sh next answers NEXT instead of HANDOFF). Absent or false: one phase per invocation. Read through non-agent nodes between two phases."
        }
      },
      "allOf": [
        {
          "if": { "properties": { "kind": { "const": "route" } }, "required": ["kind"] },
          "then": { "required": ["condition"] }
        },
        {
          "if": { "properties": { "kind": { "const": "fanin" } }, "required": ["kind"] },
          "then": { "required": ["join"] }
        },
        {
          "if": { "properties": { "kind": { "const": "loop" } }, "required": ["kind"] },
          "then": { "required": ["ceiling", "strategy"] }
        }
      ]
    }
  }
}
