{
  "id": "critique",
  "entry": "critique.challenge",
  "nodes": [
    {
      "id": "critique.challenge",
      "label": "Challenge the draft",
      "kind": "agent",
      "reads": ["currentGate", "artifacts"],
      "writes": ["currentGate", "gateHistory"],
      "effort": "system2",
      "body": "loop-spec:challenger"
    },
    {
      "id": "critique.adjudicate",
      "label": "Adjudicate the critique",
      "kind": "agent",
      "reads": ["currentGate", "gateHistory"],
      "writes": ["currentGate", "gateHistory", "artifacts"],
      "effort": "system2",
      "body": "lead-adjudicate"
    },
    {
      "id": "critique.pass",
      "label": "Record the critique result",
      "kind": "function",
      "reads": ["currentGate"],
      "writes": ["gateHistory"],
      "effort": "system1",
      "body": "lib/events.sh"
    }
  ],
  "edges": [
    {
      "from": "critique.challenge",
      "to": "critique.adjudicate",
      "kind": "chain"
    },
    {
      "from": "critique.adjudicate",
      "to": "critique.challenge",
      "kind": "loop",
      "ceiling": 1,
      "strategy": "contain"
    },
    {
      "from": "critique.adjudicate",
      "to": "critique.pass",
      "kind": "chain"
    }
  ]
}
